Botanical Name,Page title,Expected Common Name,Wikipedia Page link,
Dryopteris complexa,not found,not found,not found,
Dryopteris crassirhizoma,Dryopteris crassirhizoma,Dryopteris crassirhizoma,https://en.wikipedia.org/wiki/Dryopteris_crassirhizoma,
Dryopteris cycadina,Dryopteris cycadina,Dryopteris cycadina; shaggy shield fern; black wood fern,https://en.wikipedia.org/wiki/Dryopteris_cycadina,
Dryopteris dilatata,Dryopteris dilatata,Dryopteris dilatata; broad buckler-fern,https://en.wikipedia.org/wiki/Dryopteris_dilatata,
Dryopteris goldiana,Dryopteris goldieana,Dryopteris goldieana; Goldie's wood fern; giant wood fern,https://en.wikipedia.org/wiki/Dryopteris_goldieana,
Dryopteris lacera,Dryopteris,Dryopteris; wood ferns; male ferns; buckler ferns,https://en.wikipedia.org/wiki/Dryopteris,
Dryopteris pseudofilix-mas,not found,not found,not found,
Dryopteris remota,Dryopteris,Dryopteris; wood ferns; male ferns; buckler ferns,https://en.wikipedia.org/wiki/Dryopteris,
Dryopteris tokyoensis,Dryopteris tokyoensis,Dryopteris tokyoensis,https://en.wikipedia.org/wiki/Dryopteris_tokyoensis,
Eccremocarpus scaber,Eccremocarpus scaber,Eccremocarpus scaber; Chilean glory-flower; Chilean glory creeper,https://en.wikipedia.org/wiki/Eccremocarpus_scaber,
Echinops gmelinii,not found,not found,not found,
Echinops ritro,Echinops ritro,Echinops ritro; southern globethistle,https://en.wikipedia.org/wiki/Echinops_ritro,
Echium maculatum,Toxopneustes maculatus,Toxopneustes maculatus,https://en.wikipedia.org/wiki/Toxopneustes_maculatus,
Echium wildpretii,not found,not found,not found,
Elaeagnus ebbingei,not found,not found,not found,
Elaeagnus macrophylla,Elaeagnus,Elaeagnus; silverberry; oleaster,https://en.wikipedia.org/wiki/Elaeagnus,
Ellisiophyllum pinnatum,not found,not found,not found,
Elsholtzia stauntonii,Elsholtzia,Elsholtzia,https://en.wikipedia.org/wiki/Elsholtzia,
Encephalartos altensteinii,Encephalartos altensteinii,Encephalartos altensteinii; breadtree; broodboom; eastern Cape giant cycad; uJobane,https://en.wikipedia.org/wiki/Encephalartos_altensteinii,
Encephalartos horridus,Encephalartos horridus,Encephalartos horridus; Eastern Cape blue cycad,https://en.wikipedia.org/wiki/Encephalartos_horridus,
Enkianthus campanulatus,Enkianthus campanulatus,E. campanulatus; furin-tsutsuji; redvein enkianthus; Exposure; Spacing; Average height x width; Fertilizing; Cold hardiness; Water use,https://en.wikipedia.org/wiki/Enkianthus_campanulatus,
Enkianthus perulatus,Enkianthus perulatus,Enkianthus perulatus; dodan-tsutsuji,https://en.wikipedia.org/wiki/Enkianthus_perulatus,
Eomecon chionantha,Eomecon,Eomecon; Eomecon chionantha; snow-poppy; dawn-poppy,https://en.wikipedia.org/wiki/Eomecon,
Epimedium acuminatum,Epimedium,Epimedium; barrenwort; bishop's hat; fairy wings; horny goat weed; yin yang huo,https://en.wikipedia.org/wiki/Epimedium,
Epimedium alpinum,Epimedium,Epimedium; barrenwort; bishop's hat; fairy wings; horny goat weed; yin yang huo,https://en.wikipedia.org/wiki/Epimedium,
Epimedium brachyrrhizum,Epimedium,Epimedium; barrenwort; bishop's hat; fairy wings; horny goat weed; yin yang huo,https://en.wikipedia.org/wiki/Epimedium,
Epimedium brevicornu,not found,not found,not found,
Epimedium cantabrigiense,Epimedium,Epimedium; barrenwort; bishop's hat; fairy wings; horny goat weed; yin yang huo,https://en.wikipedia.org/wiki/Epimedium,
Epimedium diphyllum,Epimedium,Epimedium; barrenwort; bishop's hat; fairy wings; horny goat weed; yin yang huo,https://en.wikipedia.org/wiki/Epimedium,
Epimedium fargesii,Epimedium,Epimedium; barrenwort; bishop's hat; fairy wings; horny goat weed; yin yang huo,https://en.wikipedia.org/wiki/Epimedium,
Epimedium franchetii,Epimedium,Epimedium; barrenwort; bishop's hat; fairy wings; horny goat weed; yin yang huo,https://en.wikipedia.org/wiki/Epimedium,
Epimedium grandiflorum,Epimedium,Epimedium; barrenwort; bishop's hat; fairy wings; horny goat weed; yin yang huo,https://en.wikipedia.org/wiki/Epimedium,
Epimedium ilicifolium,Epimedium,Epimedium; barrenwort; bishop's hat; fairy wings; horny goat weed; yin yang huo,https://en.wikipedia.org/wiki/Epimedium,
Epimedium latisepalum,Epimedium,Epimedium; barrenwort; bishop's hat; fairy wings; horny goat weed; yin yang huo,https://en.wikipedia.org/wiki/Epimedium,
Epimedium leptorrhizum,Epimedium,Epimedium; barrenwort; bishop's hat; fairy wings; horny goat weed; yin yang huo,https://en.wikipedia.org/wiki/Epimedium,
Epimedium lishihchenii,Epimedium,Epimedium; barrenwort; bishop's hat; fairy wings; horny goat weed; yin yang huo,https://en.wikipedia.org/wiki/Epimedium,
Epimedium perralderianum,Epimedium,Epimedium; barrenwort; bishop's hat; fairy wings; horny goat weed; yin yang huo,https://en.wikipedia.org/wiki/Epimedium,
Epimedium pinnatum,Epimedium,Epimedium; barrenwort; bishop's hat; fairy wings; horny goat weed; yin yang huo,https://en.wikipedia.org/wiki/Epimedium,
Epimedium pubescens,Epimedium,Epimedium; barrenwort; bishop's hat; fairy wings; horny goat weed; yin yang huo,https://en.wikipedia.org/wiki/Epimedium,
Epimedium pubigerum,Epimedium,Epimedium; barrenwort; bishop's hat; fairy wings; horny goat weed; yin yang huo,https://en.wikipedia.org/wiki/Epimedium,
Epimedium rubrum,not found,not found,not found,
Epimedium sempervirens,Epimedium,Epimedium; barrenwort; bishop's hat; fairy wings; horny goat weed; yin yang huo,https://en.wikipedia.org/wiki/Epimedium,
Epimedium stellulatum,Epimedium,Epimedium; barrenwort; bishop's hat; fairy wings; horny goat weed; yin yang huo,https://en.wikipedia.org/wiki/Epimedium,
Epimedium warleyense,Epimedium,Epimedium; barrenwort; bishop's hat; fairy wings; horny goat weed; yin yang huo,https://en.wikipedia.org/wiki/Epimedium,
Epipremnum aureum,Epipremnum aureum,Epipremnum aureum; golden pothos; Ceylon creeper; hunter's robe; ivy arum; money plant; silver vine; Solomon Islands ivy; marble queen; taro vine; devil's vine; devil's ivy; money plant,https://en.wikipedia.org/wiki/Epipremnum_aureum,
Eremurus himalaicus,Eremurus,Eremurus; foxtail lilies; desert candles,https://en.wikipedia.org/wiki/Eremurus,
Eremurus robustus,Eremurus robustus,Eremurus robustus; foxtail lily; giant desert candle,https://en.wikipedia.org/wiki/Eremurus_robustus,
Erianthus alopecuroides,Interior Low Plateaus,Interior Low Plateaus,https://en.wikipedia.org/wiki/Interior_Low_Plateaus,
Erodium chrysanthum,Erodium,Erodium; filarees; heron's bill; storksbills,https://en.wikipedia.org/wiki/Erodium,
Eruca versicaria,Eruca vesicaria,Rocket; arugula; garden rocket; eruca,https://en.wikipedia.org/wiki/Eruca_vesicaria,
Eryngium alpinum,Eryngium alpinum,Eryngium alpinum; alpine sea holly; alpine eryngo; queen of the Alps,https://en.wikipedia.org/wiki/Eryngium_alpinum,
Eryngium bourgatii,Eryngium bourgatii,Eryngium bourgatii; Mediterranean sea holly,https://en.wikipedia.org/wiki/Eryngium_bourgatii,
Eryngium giganteum,Eryngium giganteum,Eryngium giganteum; Miss Willmott's ghost,https://en.wikipedia.org/wiki/Eryngium_giganteum,
Eryngium variifolium,Eryngium,Eryngium; eryngo; sea holly,https://en.wikipedia.org/wiki/Eryngium,
Escallonia cordobensis,Escallonia,Escallonia,https://en.wikipedia.org/wiki/Escallonia,
Escallonia rigida,not found,not found,not found,
Eucomis comosa,Eucomis comosa,Eucomis comosa; pineapple flower; pineapple lily; wine eucomis,https://en.wikipedia.org/wiki/Eucomis_comosa,
Eucommia ulmoides,Eucommia ulmoides,Eucommia ulmoides,https://en.wikipedia.org/wiki/Eucommia_ulmoides,
Euonymus carnosus,List of near threatened plants,Species; Subspecies; Species; Subspecies; Varieties; Species; Varieties; Species; Varieties; Species; Subspecies; Varieties; Species; Varieties; Species; Subspecies; Varieties; Species; Varieties; Species; Subspecies; Varieties; Species; Subspecies; Varieties; Species; Subspecies; Varieties; Species; Varieties; Species; Varieties; Species; Subspecies; Varieties; Species; Subspecies; Species; Subspecies; Varieties; Species; Subspecies; Species; Subspecies; Species; Subspecies; Species; Subspecies; Species; Varieties; Species; Subspecies; Species; Subspecies; Varieties; Species; Varieties; Species; Subspecies; Species; Varieties; Species; Subspecies; Varieties; Species; Subspecies; Varieties; Species; Varieties; Species; Varieties; Species; Subspecies; Species; Subspecies; Species; Varieties; Species; Subspecies; Species; Varieties; Species; Subspecies; Varieties; Species; Subspecies; Species; Subspecies; Varieties; Species; Subspecies; Species; Subspecies; Varieties; Species; Varieties; Species; Subspecies; Species; Subspecies; Varieties; Species; Subspecies; Species; Subspecies,https://en.wikipedia.org/wiki/List_of_near_threatened_plants,
Euonymus grandiflorus,Euonymus grandiflorus,Euonymus grandiflorus,https://en.wikipedia.org/wiki/Euonymus_grandiflorus,
Eupatorium chinense,Eupatorium chinense,Eupatorium chinense,https://en.wikipedia.org/wiki/Eupatorium_chinense,
Euphorbia amygdaloides,Euphorbia amygdaloides,Euphorbia amygdaloides; wood spurge,https://en.wikipedia.org/wiki/Euphorbia_amygdaloides,
Euphorbia characias,Euphorbia characias,Euphorbia characias; Mediterranean spurge; Albanian spurge,https://en.wikipedia.org/wiki/Euphorbia_characias,
Euphorbia dulcis,not found,not found,not found,
Euphorbia polychroma,Euphorbia epithymoides,Euphorbia epithymoides; cushion spurge,https://en.wikipedia.org/wiki/Euphorbia_epithymoides,
Euscaphis japonica,Macarostola japonica,Macarostola japonica,https://en.wikipedia.org/wiki/Macarostola_japonica,
Eustoma grandiflorum,Eustoma russellianum,Eustoma russellianum; Texas bluebells; Texas bluebell; bluebell; showy prairie gentian; prairie gentian; Lisianthus,https://en.wikipedia.org/wiki/Eustoma_russellianum,
Exacum affine,Exacum affine,Exacum affine; Persian violet,https://en.wikipedia.org/wiki/Exacum_affine,
Exochorda serratifolia,Exochorda racemosa,Exochorda racemosa; pearlbush; common pearlbush,https://en.wikipedia.org/wiki/Exochorda_racemosa,
Fallopia baldschuanica,Fallopia baldschuanica,Fallopia baldschuanica; Russian-vine; Bukhara fleeceflower; Chinese fleecevine; mile-a-minute; silver lace vine,https://en.wikipedia.org/wiki/Fallopia_baldschuanica,
Fallopia japonica,Reynoutria japonica,Reynoutria japonica; Asian knotweed; Japanese knotweed,https://en.wikipedia.org/wiki/Reynoutria_japonica,
Fargesia rufa,Fargesia rufa,Fargesia rufa; qingchuan jianzhu,https://en.wikipedia.org/wiki/Fargesia_rufa,
Festuca arundinacea,Festuca arundinacea,Festuca arundinacea; Schedonorus arundinaceus; Lolium arundinaceum; tall fescue,https://en.wikipedia.org/wiki/Festuca_arundinacea,
Festuca glauca,Festuca glauca,Festuca glauca; blue fescue,https://en.wikipedia.org/wiki/Festuca_glauca,
Ficaria verna,Ficaria verna,Ficaria verna; Ranunculus ficaria; lesser celandine; pilewort; fig buttercup,https://en.wikipedia.org/wiki/Ficaria_verna,
Ficus petiolaris,Ficus petiolaris,Ficus petiolaris; petiolate fig; rock fig; Ficus; Petiolaris; Synonymy,https://en.wikipedia.org/wiki/Ficus_petiolaris,
Filipendula denudata,not found,not found,not found,
Flueggea suffruticosa,Flueggea suffruticosa,Flueggea suffruticosa,https://en.wikipedia.org/wiki/Flueggea_suffruticosa,
Fokienia hodginsii,Fokienia,Fokienia; Fokienia hodginsii; Fujian cypress,https://en.wikipedia.org/wiki/Fokienia,
Fontanesia fortunei,Fontanesia,Fontanesia; Fontanesia phillyreoides,https://en.wikipedia.org/wiki/Fontanesia,
Fortunearia sinensis,not found,not found,not found,
Fraxinus sogdiana,Fraxinus,Fraxinus; ash,https://en.wikipedia.org/wiki/Fraxinus,
Freycinetia cumingiana,Freycinetia,Freycinetia,https://en.wikipedia.org/wiki/Freycinetia,
Freycinetia multiflora,Freycinetia multiflora,Freycinetia multiflora,https://en.wikipedia.org/wiki/Freycinetia_multiflora,
Fritillaria michailovskyi,Fritillaria michailovskyi,Fritillaria michailovskyi,https://en.wikipedia.org/wiki/Fritillaria_michailovskyi,
Fritillaria persica,Fritillaria persica,Fritillaria persica,https://en.wikipedia.org/wiki/Fritillaria_persica,
Fritillaria raddeana,Fritillaria raddeana,Fritillaria raddeana,https://en.wikipedia.org/wiki/Fritillaria_raddeana,
Galanthus alpinus,Galanthus,Galanthus; snowdrop,https://en.wikipedia.org/wiki/Galanthus,
Galanthus ikariae,Galanthus,Galanthus; snowdrop,https://en.wikipedia.org/wiki/Galanthus,
Garrya issaquahensis,Garrya,Garrya; silk tassel; tassel bush,https://en.wikipedia.org/wiki/Garrya,
Genista sagittalis,Genista,Genista; broom,https://en.wikipedia.org/wiki/Genista,
Genista spachiana,Genista stenopetala,Genista stenopetala; Sweet Broom; Easter Broom; leafy broom,https://en.wikipedia.org/wiki/Genista_stenopetala,
Gentiana angustifolia,Gentiana,Gentiana,https://en.wikipedia.org/wiki/Gentiana,
Geranium clarkei,Geranium clarkei,Geranium clarkei; Clarke's geranium,https://en.wikipedia.org/wiki/Geranium_clarkei,
Geranium macrorrhizum,Geranium macrorrhizum,Geranium macrorrhizum; bigroot geranium; Bulgarian geranium; rock crane's-bill,https://en.wikipedia.org/wiki/Geranium_macrorrhizum,
Geranium phaeum,Geranium phaeum,Geranium phaeum; dusky crane's-bill; mourning widow; black widow,https://en.wikipedia.org/wiki/Geranium_phaeum,
Geranium psilostemon,Geranium psilostemon,Geranium psilostemon; Armenian cranesbill,https://en.wikipedia.org/wiki/Geranium_psilostemon,
Geranium renardii,Geranium,Geranium; geraniums; cranesbills,https://en.wikipedia.org/wiki/Geranium,
Geranium sanguineum,Geranium sanguineum,Geranium sanguineum; bloody crane's-bill; bloody geranium,https://en.wikipedia.org/wiki/Geranium_sanguineum,
Geranium subcaulescens,Geranium subcaulescens,Geranium subcaulescens; grey cranesbill,https://en.wikipedia.org/wiki/Geranium_subcaulescens,
Geranium wlassovianum,Geranium,Geranium; geraniums; cranesbills,https://en.wikipedia.org/wiki/Geranium,
Geum coccineum,Geum coccineum,Geum coccineum; dwarf orange avens; red avens,https://en.wikipedia.org/wiki/Geum_coccineum,
Gladiolus communis,Gladiolus,Gladiolus,https://en.wikipedia.org/wiki/Gladiolus,
Globularia bisnagarica,Globularia bisnagarica,Globularia bisnagarica; common ball flower,https://en.wikipedia.org/wiki/Globularia_bisnagarica,
Glumicalyx goseloides,not found,not found,not found,
Glyptostrobus pensilis,Glyptostrobus pensilis,Glyptostrobus pensilis; Chinese swamp cypress; New World Species; New World Species,https://en.wikipedia.org/wiki/Glyptostrobus_pensilis,
Goeppertia roseopicta,not found,not found,not found,
Gomphocarpus physocarpus,Gomphocarpus physocarpus,Gomphocarpus physocarpus; hairy balls; balloonplant; balloon cotton-bush; bishop's balls; nailhead; swan plant,https://en.wikipedia.org/wiki/Gomphocarpus_physocarpus,
Goniolimon incanum,not found,not found,not found,
Goniolimon tataricum,Limonium,Limonium; sea-lavender; statice; caspia; marsh-rosemary,https://en.wikipedia.org/wiki/Limonium,
Gossypium herbaceum,Gossypium herbaceum,Gossypium herbaceum; Levant cotton,https://en.wikipedia.org/wiki/Gossypium_herbaceum,
Guajacum sanctum,Guaiacum sanctum,Guaiacum sanctum; holywood; holywood lignum-vitae,https://en.wikipedia.org/wiki/Guaiacum_sanctum,
Gymnaster savatieri,not found,not found,not found,
Gymnocladus dioica,Kentucky coffeetree,Kentucky coffeetree; Gymnocladus dioicus; Chicot,https://en.wikipedia.org/wiki/Kentucky_coffeetree,
Gypsophila aretioides,Gypsophila,Gypsophila; baby's-breath,https://en.wikipedia.org/wiki/Gypsophila,
Hacquetia epipactis,Hacquetia epipactis,Hacquetia epipactis,https://en.wikipedia.org/wiki/Hacquetia_epipactis,
Halesia monticola,Halesia monticola,Halesia; tetraptera; monticola; mountain silverbell,https://en.wikipedia.org/wiki/Halesia_monticola,
Hamamelis japonica,Hamamelis japonica,Hamamelis japonica; Japanese witch-hazel,https://en.wikipedia.org/wiki/Hamamelis_japonica,
Hamamelis mollis,Witch-hazel,Witch-hazels; witch hazels; Hamamelis; winterbloom,https://en.wikipedia.org/wiki/Witch-hazel,
Hedera nepalensis,Hedera nepalensis,Hedera nepalensis,https://en.wikipedia.org/wiki/Hedera_nepalensis,
Helianthemum mutabile,not found,not found,not found,
Helichrysum heldreichii,Helichrysum,Helichrysum,https://en.wikipedia.org/wiki/Helichrysum,
Helictotrichon sempervirens,Helictotrichon sempervirens,Helictotrichon sempervirens; blue oat grass,https://en.wikipedia.org/wiki/Helictotrichon_sempervirens,
Helleborus argutifolius,Helleborus argutifolius,Helleborus argutifolius; holly-leaved hellebore; Corsican hellebore,https://en.wikipedia.org/wiki/Helleborus_argutifolius,
Helleborus odorus,not found,not found,not found,
Hemiboea subcapitata,not found,not found,not found,
Hepatica transsilvanica,Hepatica,Hepatica; hepatica; liverleaf; liverwort,https://en.wikipedia.org/wiki/Hepatica,
Heptacodium miconioides,Heptacodium,Heptacodium miconioides; 七子花 qi zi hua; Seven Son Flower (of Zhejiang),https://en.wikipedia.org/wiki/Heptacodium,
Heuchera parviflora,Heuchera,Heuchera; alumroot; coral bells; coral bells,https://en.wikipedia.org/wiki/Heuchera,
Hibiscus striatus,Hibiscus striatus,Hibiscus striatus; striped hibiscus; striped rosemallow,https://en.wikipedia.org/wiki/Hibiscus_striatus,
Hosta cathayana,Hosta cathayana,Hosta cathayana,https://en.wikipedia.org/wiki/Hosta_cathayana,
Hosta clausa,Hosta clausa,Hosta clausa,https://en.wikipedia.org/wiki/Hosta_clausa,
Hosta densa,not found,not found,not found,
Hosta elata,Variegation,Variegation,https://en.wikipedia.org/wiki/Variegation,
Hosta hypoleuca,Hosta,Hosta; hostas; plantain lilies; giboshi,https://en.wikipedia.org/wiki/Hosta,
Hosta longipes,Hosta,Hosta; hostas; plantain lilies; giboshi,https://en.wikipedia.org/wiki/Hosta,
Hosta longissima,Hosta,Hosta; hostas; plantain lilies; giboshi,https://en.wikipedia.org/wiki/Hosta,
Hosta plantaginea,Hosta,Hosta; hostas; plantain lilies; giboshi,https://en.wikipedia.org/wiki/Hosta,
Hosta rupifraga,Hosta,Hosta; hostas; plantain lilies; giboshi,https://en.wikipedia.org/wiki/Hosta,
Hosta sieboldiana,Hosta,Hosta; hostas; plantain lilies; giboshi,https://en.wikipedia.org/wiki/Hosta,
Hosta venusta,Hosta,Hosta; hostas; plantain lilies; giboshi,https://en.wikipedia.org/wiki/Hosta,
Hoya lanceolata,Hoya,Hoya; waxplant; waxvine; waxflower; hoya,https://en.wikipedia.org/wiki/Hoya,
Hydrangea anomala,Hydrangea anomala,Hydrangea anomala; Japanese climbing-hydrangea,https://en.wikipedia.org/wiki/Hydrangea_anomala,
Hydrangea heteromalla,Hydrangea heteromalla,Hydrangea heteromalla,https://en.wikipedia.org/wiki/Hydrangea_heteromalla,
Hydrangea sargentiana,Hydrangea sargentiana,Hydrangea sargentiana,https://en.wikipedia.org/wiki/Hydrangea_sargentiana,
Hydrangea serrata,Hydrangea serrata,Hydrangea serrata; mountain hydrangea; tea of heaven,https://en.wikipedia.org/wiki/Hydrangea_serrata,
Hydrocotyle vulgaris,Hydrocotyle vulgaris,Hydrocotyle vulgaris; marsh pennywort; common pennywort; water naval; money plant; lucky plant; copper coin,https://en.wikipedia.org/wiki/Hydrocotyle_vulgaris,
Hylotelephium telephium,Hylotelephium telephium,Hylotelephium telephium; orpine; livelong; frog's-stomach; harping Johnny; life-everlasting; live-forever; midsummer-men; Orphan John; witch's moneybags,https://en.wikipedia.org/wiki/Hylotelephium_telephium,
Hymenocallis caroliniana,Hymenocallis caroliniana,Hymenocallis caroliniana; Carolina spiderlily,https://en.wikipedia.org/wiki/Hymenocallis_caroliniana,
Hymenocallis festalis,not found,not found,not found,
Hypericum buckleyi,Hypericum buckleyi,Hypericum buckleyi; Buckley's St. Johnswort; Hypericum buckleii,https://en.wikipedia.org/wiki/Hypericum_buckleyi,
Hypericum kouytchense,Hypericum kouytchense,Hypericum kouytchense; large-flowered St John’s wort,https://en.wikipedia.org/wiki/Hypericum_kouytchense,
Hypericum pyramidatum,not found,not found,not found,
Iberis saxatilis,not found,not found,not found,
Ilex ciliospinosa,Holly,Ilex; holly; Aquifoliaceae,https://en.wikipedia.org/wiki/Holly,
Ilex colchica,Ilex colchica,Ilex colchica; Colchic-; Black Sea holly,https://en.wikipedia.org/wiki/Ilex_colchica,
Ilex meserveae,not found,not found,not found,
Iliamna remota,Iliamna remota,Iliamna remota; Kankakee mallow,https://en.wikipedia.org/wiki/Iliamna_remota,
Impatiens hawkeri,Impatiens hawkeri,Impatiens hawkeri; New Guinea impatiens,https://en.wikipedia.org/wiki/Impatiens_hawkeri,
Impatiens omeiana,Impatiens omeiana,Impatiens omeiana; hardy impatiens,https://en.wikipedia.org/wiki/Impatiens_omeiana,
Inula conyza,Inula conyza,Inula conyza; ploughman's-spikenard,https://en.wikipedia.org/wiki/Inula_conyza,
Inula verbascifolia,Inula,Inula,https://en.wikipedia.org/wiki/Inula,
Ionactis linariifolia,Ionactis linariifolia,Ionactis linariifolia; flax-leaf ankle-aster; flaxleaf whitetop; aster,https://en.wikipedia.org/wiki/Ionactis_linariifolia,
Ipheion uniflorum,Ipheion uniflorum,Ipheion uniflorum; springstar; spring starflower,https://en.wikipedia.org/wiki/Ipheion_uniflorum,
Iris aucheri,Iris aucheri,Iris aucheri; Aucher-Éloy iris,https://en.wikipedia.org/wiki/Iris_aucheri,
Iris danfordiae,Iris danfordiae,Iris danfordiae; dwarf iris; Danford iris; dwarf iris; buttercup Iris; Danford's iris,https://en.wikipedia.org/wiki/Iris_danfordiae,
Iris domestica,Iris domestica,Iris domestica; leopard lily; blackberry lily; leopard flower,https://en.wikipedia.org/wiki/Iris_domestica,
Iris graminea,Iris graminea,Iris graminea; grass-leaved flag; grass leaved iris; plum iris; plum tart iris,https://en.wikipedia.org/wiki/Iris_graminea,
Iris japonica,Iris japonica,Iris japonica; fringed iris; shaga; butterfly flower,https://en.wikipedia.org/wiki/Iris_japonica,
Iris maackii,Iris maackii,Iris maackii,https://en.wikipedia.org/wiki/Iris_maackii,
Iris spuria,Iris spuria,Iris spuria,https://en.wikipedia.org/wiki/Iris_spuria,
Iris wattii,Iris wattii,Iris wattii,https://en.wikipedia.org/wiki/Iris_wattii,
Isotoma axillaris,Isotoma axillaris,Isotoma axillaris; rock isotome; showy isotome,https://en.wikipedia.org/wiki/Isotoma_axillaris,
Itea ilicifolia,Itea ilicifolia,Itea ilicifolia; holly-leaved sweet spire,https://en.wikipedia.org/wiki/Itea_ilicifolia,
Itea japonica,Itea (plant),Itea,https://en.wikipedia.org/wiki/Itea_(plant),
Jacobaea maritima,Jacobaea maritima,Jacobaea maritima; silver ragwort; Senecio cineraria; dusty miller,https://en.wikipedia.org/wiki/Jacobaea_maritima,
Jasminum stephanense,not found,not found,not found,
Juniperus communis,Juniperus communis,Juniperus communis; common juniper,https://en.wikipedia.org/wiki/Juniperus_communis,
Juniperus recurva,Juniperus recurva,Juniperus recurva; Himalayan juniper; drooping juniper,https://en.wikipedia.org/wiki/Juniperus_recurva,
Justicia aurea,Justicia aurea,Justicia aurea; Brazilian plume; yellow jacobinia,https://en.wikipedia.org/wiki/Justicia_aurea,
Justicia scheidweileri,not found,not found,not found,
Justicia tweediana,not found,not found,not found,
Kalanchoe beharensis,Kalanchoe beharensis,Kalanchoe beharensis; elephant's ear kalanchoe; felt bush; feltbush,https://en.wikipedia.org/wiki/Kalanchoe_beharensis,
Kalimeris pinnatifida,Kalimeris pinnatifida,Kalimeris pinnatifida; double Japanese aster,https://en.wikipedia.org/wiki/Kalimeris_pinnatifida,
Kalimeris yomena,not found,not found,not found,
Kirengeshoma koreana,Kirengeshoma koreana,Kirengeshoma koreana; Korean kirengeshoma,https://en.wikipedia.org/wiki/Kirengeshoma_koreana,
Kirengeshoma palmata,Kirengeshoma palmata,Kirengeshoma palmata; yellow wax bells,https://en.wikipedia.org/wiki/Kirengeshoma_palmata,
Kitaibelia vitifolia,not found,not found,not found,
Knautia macedonica,Knautia,Knautia,https://en.wikipedia.org/wiki/Knautia,
Kniphofia brachystachya,Kniphofia,"Kniphofia; tritoma, red hot poker, torch lily, knofflers; poker plant",https://en.wikipedia.org/wiki/Kniphofia,
Kniphofia caulescens,Kniphofia,"Kniphofia; tritoma, red hot poker, torch lily, knofflers; poker plant",https://en.wikipedia.org/wiki/Kniphofia,
Koeleria argentea,Koeleria,Koeleria; Junegrasses,https://en.wikipedia.org/wiki/Koeleria,
Koeleria glauca,Koeleria glauca,Koeleria glauca; blue hair grass,https://en.wikipedia.org/wiki/Koeleria_glauca,
Lagunaria patersonii,Lagunaria,Lagunaria; Lagunaria patersonia; pyramid tree; Norfolk Island hibiscus; Queensland white oak; sally wood; white oak; itchy bomb tree; cow itch tree,https://en.wikipedia.org/wiki/Lagunaria,
Lamium galeobdolon,Lamium galeobdolon,Lamium galeobdolon; yellow archangel; artillery plant; aluminium plant; yellow weasel-snout,https://en.wikipedia.org/wiki/Lamium_galeobdolon,
Larix gmelinii,Larix gmelinii,Larix gmelinii; Dahurian larch,https://en.wikipedia.org/wiki/Larix_gmelinii,
Lavandula multifida,Lavandula multifida,Lavandula multifida; fernleaf lavender; Egyptian lavender,https://en.wikipedia.org/wiki/Lavandula_multifida,
Leontopodium alpinum,Leontopodium nivale,Leontopodium nivale; edelweiss,https://en.wikipedia.org/wiki/Leontopodium_nivale,
Leontopodium palibinianum,Leontopodium palibinianum,Leontopodium palibinianum,https://en.wikipedia.org/wiki/Leontopodium_palibinianum,
Leptinella squalida,Leptinella squalida,Leptinella squalida,https://en.wikipedia.org/wiki/Leptinella_squalida,
Leptodermis oblonga,Leptodermis,Leptodermis,https://en.wikipedia.org/wiki/Leptodermis,
Leucothoe racemosa,Eubotrys racemosa,Eubotrys racemosa; fetterbush; swamp doghobble; swamp sweetbells,https://en.wikipedia.org/wiki/Eubotrys_racemosa,
