SR No,PlantName,Category,Wiki link,Page Data,
104,Date_palm,Tree,https://en.wikipedia.org/wiki/Date_palm,"Phoenix dactylifera, commonly known as date or date palm, is a flowering plant species in the palm family, Arecaceae, cultivated for its edible sweet fruit. Although its exact place of origin is uncertain because of long cultivation, it probably originated from the Fertile Crescent region straddling between Egypt and Mesopotamia. The species is widely cultivated across Northern Africa, the Middle East, the Horn of Africa and South Asia, and is naturalized in many tropical and subtropical regions worldwide. P. dactylifera is the type species of genus Phoenix, which contains 12–19 species of wild date palms, and is the major source of commercial production.Date trees typically reach about 21–23 metres (69–75 ft) in height, growing singly or forming a clump with several stems from a single root system. Date fruits (dates) are oval-cylindrical, 3 to 7 centimetres (1.2 to 2.8 in) long, and about 2.5 centimetres (0.98 in) in diameter, ranging from bright red to bright yellow in colour, depending on variety. They are very sweet, containing about 75 percent of sugar when dried.
Dates have been a staple food of the Middle East and the Indus Valley for thousands of years. There is archaeological evidence of date cultivation in Arabia from the 6th millennium BCE. The total annual world production of dates amounts to 8.5 million metric tons, countries of the Middle East and North Africa being the largest producers.


== Etymology ==
The species name dactylifera ""date-bearing"" comes from the Greek words daktylos (δάκτυλος), which means ""date"" (also ""finger""), and  fero (φέρω), which means ""I bear"". The fruit is known as a date. The fruit's English name (through Old French), as well as the Latin both come from the Greek word for ""finger"", dáktulos, because of the fruit's elongated shape.


== History ==
Fossil records show that the date palm has existed for at least 50 million years.

Dates have been a staple food of the Middle East and the Indus Valley for thousands of years. There is archaeological evidence of date cultivation in eastern Arabia between 5530 and 5320 calBC. They are believed to have originated around what is now Iraq, and have been cultivated since ancient times from Mesopotamia to prehistoric Egypt. The Ancient Egyptians used the fruits to make date wine, and ate them at harvest.
There is archaeological evidence of date cultivation in Mehrgarh around 7000 BCE, a Neolithic civilization in what is now western Pakistan.  Evidence of cultivation is continually found throughout later civilizations in the Indus Valley, including the Harappan period 2600 to 1900 BCE.In Ancient Rome the palm fronds used in triumphal processions to symbolize victory were most likely those of Phoenix dactylifera. The date palm was a popular garden plant in Roman peristyle gardens, though it would not bear fruit in the more temperate climate of Italy. It is recognizable in frescoes from Pompeii and elsewhere in Italy, including a garden scene from the House of the Wedding of Alexander.In later times, traders spread dates around South West Asia, northern Africa, and Spain. Dates were introduced into Mexico and California by the Spaniards in 1765, around Mission San Ignacio.
A date palm cultivar, probably what used to be called Judean date palm, is renowned for its long-lived orthodox seed, which successfully sprouted after accidental storage for 2000 years. The upper survival time limit of properly stored seeds remains unknown.A genomic study from New York University Abu Dhabi Center for Genomics and Systems Biology showed that domesticated date palm varieties from North Africa, including well-known varieties such as Medjool and Deglet Nour, are a hybrid between Middle East date palms and the Cretan wild palm P. theophrasti. Date palms appear in the archaeological record in North Africa about 2,800 years ago, suggesting that the hybrid was spread by the Minoans or Phoenicians.


== Description ==

Date trees typically reach about 21–23 metres (69–75 ft) in height, growing singly or forming a clump with several stems from a single root system. The leaves are 4–6 metres (13–20 ft) long, with spines on the petiole, and pinnate, with about 150 leaflets. The leaflets are 30 cm (12 in) long and 2 cm (0.79 in) wide. The full span of the crown ranges from 6–10 m (20–33 ft).
The date palm is dioecious, having separate male and female plants. They can be easily grown from seed, but only 50% of seedlings will be female and hence fruit bearing, and dates from seedling plants are often smaller and of poorer quality. Most commercial plantations thus use cuttings of heavily cropping cultivars. Plants grown from cuttings will fruit 2–3 years earlier than seedling plants.
Dates are naturally wind pollinated, but in both traditional oasis horticulture and in the modern commercial orchards they are entirely pollinated manually. Natural pollination occurs with about an equal number of male and female plants. However, with assistance, one male can pollinate up to 100 females. Since the males are of value only as pollinators, this allows the growers to use their resources for many more fruit-producing female plants. Some growers do not even maintain any male plants, as male flowers become available at local markets at pollination time. Manual pollination is done by skilled labourers on ladders, or by use of a wind machine. In some areas such as Iraq the pollinator climbs the tree using a special climbing tool that wraps around the tree trunk and the climber's back (called تبلية in Arabic) to keep him attached to the trunk while climbing.

Date fruits are oval-cylindrical, 3–7 cm (1.2–2.8 in) long, and 2–3 cm (0.79–1.18 in) diameter, and when ripe, range from bright red to bright yellow in colour, depending on variety. Dates contain a single stone about 2–2.5 cm (0.8–1.0 in) long and 6–8 mm (0.2–0.3 in) thick. Three main cultivar groups of date exist: soft (e.g. 'Barhee', 'Halawy', 'Khadrawy', 'Medjool'); semi-dry (e.g. 'Dayri', 'Deglet Nour', 'Zahdi'), and dry (e.g. 'Thoory'). The type of fruit depends on the glucose, fructose, and sucrose content.


=== Genome ===
In 2009, a team of researchers at the Weill Cornell Medical College in Qatar published a draft version of the date palm genome (Khalas variety). The draft genome sequence was improved in 2019 with the release of a more complete genome sequence using small molecule real-time sequencing technology by a team from the New York University Abu Dhabi Center for Genomics and Systems Biology and the UAE University Khalifa Center for Genetic Engineering and Biotechnology in the United Arab Emirates. With the release of this improved genome assembly, the UAE researchers were able to map genes for fruit color and sugar content.  The NYU Abu Dhabi researchers had also re-sequenced the genomes of several date varieties to develop the first single nucleotide polymorphism map of the date palm genome in 2015.


== Cultivation ==

Dates are an important traditional crop in Iraq, Iran, Arabia, and north Africa west to Morocco. Dates (especially Medjool and Deglet Noor) are also cultivated in America in southern California, Arizona and southern Florida in the United States and in Sonora and Baja California in Mexico.
Date palms can take 4 to 8 years after planting before they will bear fruit, and start producing viable yields for commercial harvest between 7 and 10 years. Mature date palms can produce 150–300 lb (70–140 kg) of dates per harvest season. They do not all ripen at the same time so several harvests are required. To obtain fruit of marketable quality, the bunches of dates must be thinned and bagged or covered before ripening so that the remaining fruits grow larger and are protected from weather and animals that also live off of it, such as birds.

Date palms require well-drained deep sandy loam soils with a pH of 8-11 (i.e., alkali). The soil should have the ability to hold the moisture. The soil should also be free from calcium carbonate.


=== Production ===


=== Cultivars ===

A large number of date cultivars are grown. The most important are:

Aabel – common in Libya.
Ajwah – from the town of Medina in Saudi Arabia, it is the subject of a Hadith.
Al-Khunaizi – from the town of Qatif in Saudi Arabia.
Amir Hajj or Amer Hajj – from Iraq, these are soft with a thin skin and thick flesh, sometimes called ""the visitor's date"" because it is a delicacy served to guests.
ʿAbid Rahim (Arabic: عبد رحيم‎) – from Sudan.  In Nigeria it is called Dabino.
Barakawi (Arabic: بركاوي‎) – from Sudan.
Barhee or barhi (from Arabic  barh, meaning 'a hot wind') – these are nearly spherical, light amber to dark brown when ripe; soft, with thick flesh and rich flavour. One of the few varieties that are good in the khalal stage when they are yellow (like a fresh grape, as opposed to dry, like a raisin).
Bireir (Arabic: برير‎) – from Sudan.
Dabbas – from United Arab Emirates.
Datça – in Turkey
Deglet Noor Algerian cultivar originated from the zibane region in the north eastern Algerian desert (the oases of Tolga, Biskra) — so named because the centre appears light or golden when held up to the sun. This is a leading date in Libya, Algeria, the United States, and Tunisia.
Derrie or Dayri (the ""Monastery"" date) – from southern Iraq – these are long, slender, nearly black, and soft.
Empress –  developed by the DaVall family in Indio, California, United States, from a seedling of Thoory. It is large, and is softer and sweeter than Thoory. It generally has a light tan top half and brown bottom half.
Fardh or Fard –  common in Oman, deep dark brown, tender skin, sweet flavor, small seed. Keeps well when well packed.
Ftimi or Alligue – these are grown in inland oases of Tunisia.
Holwah (Halawi) (Arabic for sweet) – these are soft, and extremely sweet, small to medium in size.
Haleema – in Hoon, Libya (Haleema is a woman's name).
Hayany (Hayani) – from Egypt (""Hayany"" is a man's name) – these dates are dark-red to nearly black and soft.
Iteema – common in Algeria.
Kenta – common in Tunisia.
Khadrawi or Khadrawy (Arabic: 'green') – a cultivar favoured by many Arabs, it is a soft, very dark date.
Khalasah (Arabic for quintessence) – one of the major palm cultivars in Saudi Arabia. Its fruit is called Khlas. Notably produced in Hofuf (Al-Ahsa) and Qatif in the Eastern Province of Saudi Arabia (ash-Sharqīyah).
Khastawi (Khusatawi, Kustawy) – this is the leading soft date in Iraq; it is syrupy and small in size, prized for dessert.
Khenaizi – from United Arab Emirates.
Lulu – from United Arab Emirates.
Maktoom (Arabic for hidden) – this is a large, red-brown, thick-skinned, soft, medium-sweet date.
Manakbir – a large fruit that ripens early.
Medjool or (Majdool) (Arabic: مجدول‎) – from Morocco, also grown in the United States, Israel, Saudi Arabia, South Africa, Jordan, and United Arab Emirates; a large, sweet and succulent date.
Migraf (Mejraf) – very popular in Southern Yemen, these are large, golden-amber dates.
Mgmaget Ayuob – from Hun, Libya.
Mishriq (Arabic: مشرق‎ ""east"") – from Sudan and Saudi Arabia.
Mazafati or Mozafati – (Persian: مضافتی‎, ""Suburban/Peripheral"")  It is a dark, fleshy and sweet date of medium size with a relatively high moisture content and is suited for fresh consumption, i.e. not dried. At a temperature of −5 degrees Celsius (23 °F) it can be kept for up to 2 years. It is grown in Iran, in particular in Kerman province, and often named ""Bam date"", after the city of Bam in that province.
Nabtat-seyf – in Saudi Arabia.
Piarom – A large, thin skin, black-brown semi-dry date - from Iran.
Rotab (Arabic: رطب) – from Iraq, they are dark and soft.
Safawi - mainly grown in Saudi Arabia in the Al-Madina region. Soft, semi-dried date variety; distinctive deep black colour, length and medium size. Share similarities with Ajwa dates such as taste.
Sag‘ai – from Saudi Arabia.
Saidy (Saidi) – soft, very sweet, these are popular in Libya.
Sayer (Sayir) (Arabic for common) – these dates are dark orange-brown, of medium size, soft and syrupy.
Sukkary – (Arabic: سكري, ""Sugar"" or ""Sweet one"") Yellow skinned; faintly resilient and extremely sweet, often referred to as ‘royal dates’. It's cultivated primarily in Al Qassim, Saudi Arabia. It's arguably the most expensive and premium variety.
Sellaj – (Arabic: سلّج‎) in Saudi Arabia.
Indi - (Sinhala: ඉඳ) called in Sri Lanka.
Tagyat – common in Libya.
Tamej – in Libya.
Thoory (Thuri) – popular in Algeria, this dry date is brown-red when cured with a bluish bloom and very wrinkled skin. Its flesh is sometimes hard and brittle but the flavour described as sweet and nutty.
Umeljwary – in Libya.
Umelkhashab – Brilliant red skin; bittersweet, hard white flesh (Saudi Arabia).
Zahidi (Arabic for [Of the] ascetic) – these medium size, cylindrical, light golden-brown semi-dry dates are very sugary, and sold as soft, medium-hard and hard.
Zaghloul (Arabic: زغلول‎) – Dark red skin, long, and very crunchy when fresh (when they are typically served); extremely sweet, with sugar content creating a sense of desiccation in the mouth when eaten. The variety is essentially exclusive to Egypt, where it is subject to an element of nationalist sentiment on account of sharing a name with national hero Saad Zaghloul.The Gaza Strip, especially Deir al-Balah (""Village of Dates""), is known for its exceptionally sweet red dates.


== Diseases and pests ==

A major palm pest, the red palm beetle (Rhynchophorus ferrugineus) currently poses a significant threat to date production in parts of the Middle East as well as to iconic landscape specimens throughout the Mediterranean world.
In the 1920s, eleven healthy Madjool palms were transferred from Morocco to the United States where they were tended by members of the Chemehuevi tribe in a remote region of Nevada. Nine of these survived and in 1935, cultivars were transferred to the ""U.S. Date Garden"" in Indio, California. Eventually this stock was reintroduced to Africa and led to the U.S. production of dates in Yuma, Arizona, and the Bard Valley in California.


== Uses ==


=== Fruits ===
Dry or soft dates are eaten out-of-hand, or may be pitted and stuffed with fillings such as almonds, walnuts, pecans, candied orange and lemon peel, tahini, marzipan or cream cheese. Pitted dates are also referred to as stoned dates. Partially dried pitted dates may be glazed with glucose syrup for use as a snack food. Dates can also be chopped and used in a range of sweet and savory dishes, from tajines (tagines) in Morocco to puddings, ka'ak (types of Arab cookies) and other dessert items. Date nut bread, a type of cake, is very popular in the United States, especially around holidays. Dates are also processed into cubes, paste called  'ajwa, spread, date syrup or ""honey"" called ""dibs"" or rub in Libya, powder (date sugar), vinegar or alcohol. Vinegar made from dates is a traditional product of the Middle East. Recent innovations include chocolate-covered dates and products such as sparkling date juice, used in some Islamic countries as a non-alcoholic version of champagne, for special occasions and religious times such as Ramadan. When Muslims break fast in the evening meal of Ramadan, it is traditional to eat a date first.
Reflecting the maritime trading heritage of Britain, imported chopped dates are added to, or form the main basis of a variety of traditional dessert recipes including sticky toffee pudding, Christmas pudding and date and walnut loaf. They are particularly available to eat whole at Christmas time. Dates are one of the ingredients of HP Sauce, a popular British condiment.
Dates can also be dehydrated, ground and mixed with grain to form a nutritious stockfeed.
In Southeast Spain (where a large date plantation exists including UNESCO-protected Palmeral of Elche) dates (usually pitted with fried almond) are served wrapped in bacon and shallow fried, served with ranch dressing.
In Israel date syrup, termed silan, is used while cooking chicken and also for sweet and desserts, and as a honey substitute.
Dates are one of the ingredients of jallab, a Middle-Eastern fruit syrup.
In Pakistan, a viscous, thick syrup made from the ripe fruits is used as a coating for leather bags and pipes to prevent leaking.


==== Nutritional value ====
Dates provide a wide range of essential nutrients, and are a very good source of dietary potassium. The sugar content of ripe dates is about 80%; the remainder consists of protein, fiber, and trace elements including boron, cobalt, copper, fluorine, magnesium, manganese, selenium, and zinc.  The glycemic index for three different varieties of dates are 35.5 (khalas), 49.7 (barhi), and 30.5 (bo ma'an).The caffeic acid glycoside 3-O-caffeoylshikimic acid (also known as dactylifric acid) and its isomers, are enzymic browning substrates found in dates.


=== Other parts ===


==== Seeds ====
Date seeds are soaked and ground up for animal feed. Their oil is suitable for use in soap and cosmetics. Date palm seeds contain 0.56–5.4% lauric acid. They can also be processed chemically as a source of oxalic acid. Date seeds are also ground and used in the manner of coffee beans, or as an additive to coffee.
Experimental studies have shown that feeding mice with the aqueous extract of date pits exhibit anti-genotoxic and reduce DNA damage induced by N-nitroso-N-methylurea.


==== Fruit clusters ====
Stripped fruit clusters are used as brooms. Recently the floral stalks have been found to be of ornamental value in households.


==== Sap ====

Apart from P. dactylifera, wild date palms such as Phoenix sylvestris and Phoenix reclinata, depending on the region, can be also tapped for sap.


==== Leaves ====
Date palm leaves are used for Palm Sunday in the Christian religion. In North Africa, they are commonly used for making huts. Mature leaves are also made into mats, screens, baskets and fans. Processed leaves can be used for insulating board. Dried leaf petioles are a source of cellulose pulp, used for walking sticks, brooms, fishing floats and fuel. Leaf sheaths are prized for their scent, and fibre from them is also used for rope, coarse cloth, and large hats. The leaves are also used as a lulav in the Jewish holiday of Sukkot.
Young date leaves are cooked and eaten as a vegetable, as is the terminal bud or heart, though its removal kills the palm. The finely ground seeds are mixed with flour to make bread in times of scarcity. The flowers of the date palm are also edible. Traditionally the female flowers are the most available for sale and weigh 300–400 grams (11–14 oz). The flower buds are used in salad or ground with dried fish to make a condiment for bread.


== Culture ==

Dates are mentioned more than 50 times in the Bible and 20 times in the Qur'an. 
Many Jewish scholars believe that the ""honey"" reference in the Bible to ""a land flowing with milk and honey"" (Exodus chapter 3) is actually a reference to date ""honey"", and not honey from bees.In Islamic culture, dates and yogurt or milk are traditionally the first foods consumed for Iftar after the sun has set during Ramadan.
The date palm represents the provincial tree of Balochistan (Pakistan) (unofficial).


=== Symbolism ===

In the Quran, Allah instructs Maryām (the Virgin Mary) to eat dates when she gives birth to Isa (Jesus); and, similarly, they are recommended to pregnant women.Phoenix dactylifera held great significance in early Judaism and subsequently in Christianity, in part because the tree was heavily cultivated as a food source in ancient Israel.
In the Bible palm trees are referenced as symbols of prosperity and triumph. In Psalm 92:12 ""The righteous shall flourish like the palm tree"". Palm branches occurred as iconography in sculpture ornamenting the Second Jewish Temple in Jerusalem, on Jewish coins, and in the sculpture of synagogues. They are also used as ornamentation in the Feast of the Tabernacles. Palm branches were scattered before Jesus as he entered Jerusalem on Palm Sunday.


== Gallery ==

		
		
		
		
		
		
		
		
		
		
		
		
		
		
		
		
		
		
		
		


== References ==


== External links ==
INC, International Nut and Dried Fruit Council Foundation
Date Palm Cultivation (Food and Agriculture Organization)
Date Palm Products (Additional information from the FAO)
Date Palm entry in Encyclopaedia Iranica",
105,Phoenix_reclinata,Tree,https://en.wikipedia.org/wiki/Phoenix_reclinata,"Phoenix reclinata (reclinata - Latin, reclining),  the wild date palm or Senegal date palm, is a species of flowering plant in the palm family native to tropical Africa, the Arabian Peninsula, Madagascar and the Comoro Islands. It is also reportedly naturalized in Florida, Puerto Rico, Bermuda and the Leeward Islands. The plants are found from sea level to 3000 m, in rain forest clearings, monsoonal forests and rocky mountainsides.


== Description ==

Phoenix reclinata is a dioecious clumping palm, producing multiple stems from 7.5 to 15 m in height and 30 cm in width. Foliage is pinnate and recurved, growing 2.5 to 4.5 m in length and 0.75 m in width. Leaf color is bright to deep green on 30 cm petioles with long, sharp spines at the base, with 20 to 40 leaves per crown.
The plants are unisexual and florets appear at the top of the palm stem. Male florets are a dirty, pale yellow and fall off after blooming; females are small, globose and yellow-green. This species grows edible, oblong fruit, orange in color (when ripe), at 2.5 cm in diameter. The fruit are borne in large, pendant clusters and contain one seed each.Palms across the genus Phoenix readily hybridize with one another resulting in naturally occurring variations.  They usually tolerate salt-spray, and moderate drought where the water table is permanently high.


== Uses ==

In addition to the fruit, which attracts animals as well as humans, the palm heart can be eaten as a vegetable. In KwaZulu-Natal, and the Okavango Delta, Botswana, the sap is tapped shortly before flowering to make palm wine. The fibres of young, unopened leaves can be used to make carpets, kilts and brooms. The roots contain tannin and can be used to make a brown dye. They also produce an edible gum. The wood is lightweight and not particularly useful.


== References ==

Riffle, Robert L. and Craft, Paul (2003) An Encyclopedia of Cultivated Palms. Portland: Timber Press. ISBN 0-88192-558-6 / ISBN 978-0-88192-558-6 (Pages 403-404)


== External links ==
Floridata Link
PACSAO Link
Phoenix reclinata in West African plants – A Photo Guide.",
106,Phoenix_roebelenii,House Plant,https://en.wikipedia.org/wiki/Phoenix_roebelenii,"Phoenix roebelenii, with common names of pygmy date palm, miniature date palm or just robellini, is a species of date palm native to southeastern Asia, from southwestern China (Yunnan Province), northern Laos and northern Vietnam, (in Dien Bien Province, Ha Giang Province, Cao Bang Province, Lang Son Province).The Latin specific epithet roebelenii honours the orchid collector Carl Roebelen (1855-1927)


== Description ==
Phoenix roebelenii is a small to medium-sized, slow-growing slender tree growing to 2–3 metres (6.6–9.8 ft) tall.  The leaves are 60–120 cm (24–47 in) long, pinnate, with around 100 leaflets arranged in a single plane (unlike the related P. loureiroi where the leaflets are in two planes). Each leaflet is 15–25 cm (6–10 in)long and 1 cm broad, slightly drooping, and grey-green in colour with scurfy pubescence below.
The flowers are small, yellowish, produced on a 45 cm (18 in) inflorescence. The fruit is an edible 1 cm drupe resembling a small, thin-fleshed date.


== Cultivation and uses ==
Phoenix roebelenii, is a popular ornamental plant in gardens in tropical and subtropical  climate areas. With a minimum temperature requirement of 26 Fahrenheit (-3 Celsius) it is grown under glass or as a houseplant in cooler areas. It needs little pruning to develop a strong structure, is resistant to pests, is tolerant to soil variation, and is moderately drought tolerant. The plant grows in partial shade to full sun, with the local climate determining where to plant.
This plant has gained the Royal Horticultural Society's Award of Garden Merit.The NASA Clean Air Study concluded that this was a plant that was effective at removing common household air toxins formaldehyde and benzene.


== Gallery ==

		
		


== References ==


== External links ==",
