SR No,PlantName,Category,Wiki link,Page Data,
154,Ulmus_parvifolia,Tree,https://en.wikipedia.org/wiki/Ulmus_parvifolia,"Ulmus parvifolia, commonly known as the Chinese elm or lacebark elm, is a species native to eastern Asia, including China, Taiwan, Japan, North Korea, and Vietnam. It has been described as ""one of the most splendid elms, having the poise of a graceful Nothofagus"".The tree was introduced to the UK in 1794 by James Main, who collected in China for Gilbert Slater of Low Layton, Essex.


== Description ==
A small to medium deciduous, semi-deciduous (rarely semi-evergreen) tree growing to 10–18 m (33–59 ft) tall and 15–20 m (49–66 ft) wide with a slender trunk and crown. The leathery, lustrous green single-toothed leaves are small, 2–5 cm long by 1–3 cm broad, and often retained as late as December or even January in Europe and North America. The apetalous wind-pollinated perfect flowers are produced in early autumn, small and inconspicuous. The fruit is a samara, elliptic to ovate-elliptic, 10–13 mm long by 6–8 mm broad. The samara is mostly glabrous, the seed at the centre or toward the apex, borne on a stalk 1–3 mm in length; it matures rapidly and disperses by late autumn. The trunk has a handsome, flaking bark of mottled greys with tans and reds, giving rise to its other common name, the lacebark elm, although scarring from major branch loss can lead to large canker-like wounds. Ploidy: 2n = 28.

		
		
		
		
Many nurserymen and foresters mistakenly refer to Ulmus pumila, the rapidly growing, disease-ridden, relatively short-lived, weak-wooded Siberian elm, as ""Chinese elm."" This has given the true Chinese elm an undeserved bad reputation. The two elms are very distinct and different species. Among other obvious differences, with age the Siberian elm's bark becomes deeply ridged and furrowed, and possesses a very rough, greyish-black appearance, while the Chinese elm's smooth bark becomes flaky and blotchy, exposing very distinctive, light-coloured mottling, hence the synonym lacebark elm for the real Chinese elm.


== Wood and timber ==
Elms, hickory and ash all have remarkably hard, tough wood that has made them popular for things like tool handles, bows and baseball bats. Chinese elm is considered the hardest of the elms. Owing to its superior hardness, toughness and resistance to splitting, Chinese elm is said to be the best of all woods for chisel handles and similar uses. Chinese elm lumber is used most for furniture, cabinets, veneer and hardwood flooring, as well as specialty uses such as long bow construction and tool handles. Most of the commercially milled lumber goes directly to manufacturers rather than to retail lumber outlets.Chinese elm heartwood ranges in tone from reddish brown to light tan or flesh coloured, while the sapwood approaches off-white. The grain is often handsome and dramatic.  Unlike other elms, freshly cut Chinese elm has a peppery or spicy odour.  While it turns easily and will take a nice polish off the lathe without any finish, and it holds detail well, the fibrous wood is usually considered too tough for carving or hand tools.  Chinese elm contains silica which is hard on planer knives and chainsaws, but it sands fairly easily. Like other woods with interlocking grain, planes should be kept extra sharp to prevent tearing at the grain margins. It steam-bends easily, holds screws well but pilot holes and countersinking are needed.  It tends to be a ""lively"" wood, tending to warp and distort while drying. This water resistant wood easily takes most finishes and stains.


== Taxonomy ==
Subspecies, varieties, and forms:

Ulmus parvifolia var. coreana Nakai
Ulmus parvifolia f. lanceolata Ueki


== Pests and diseases ==
The Chinese elm is highly resistant, but not immune, to Dutch elm disease. It is also very resistant to the elm leaf beetle Xanthogaleruca luteola [2], but has a moderate susceptibility to elm yellows. In trials at the Sunshine Nursery, Oklahoma, the species was adjudged as having the best pest resistance of about 200 taxa  However, foliage was regarded as only ""somewhat resistant"" to black spot by the Plant Diagnostic Clinic of the University of Missouri.Cottony cushion scale or mealy bugs, often protected and ""herded"" by ants, exude sticky, sweet honeydew which can mildew leaves and be a minor annoyance by dripping on cars and furniture. However, severe infestations on, or obvious damage to, otherwise healthy trees are uncommon.


== Cultivation ==
The Chinese elm is a tough landscape tree, hardy enough for use in harsh planting situations such as parking lots, in small planters along streets and in plazas or patios. The tree is arguably the most ubiquitous of the elms, now found on all continents except Antarctica. It was introduced to Europe at the end of the 18th century as an ornamental, and is found in many botanical gardens and arboreta. It was introduced to the United States in 1794, and has proved very popular in recent years as a replacement for American elms killed by Dutch elm disease. The tree was distributed in Victoria, Australia, from 1857. At the beginning of the 20th century it was marketed by Searl's Garden Emporium, Sydney. In New Zealand, it was found to be particularly suitable for windswept locations along the coast. The tree is commonly planted as an ornamental in Japan,  notably around Osaka Castle.
Ulmus parvifolia is one of the cold-hardiest of the Chinese species. In artificial freezing tests at the Morton Arboretum. the LT50 (temp. at which 50% of tissues die) was found to be −34 °C (−29 °F).

		


=== Bonsai ===
Owing to its versatility and ability to tolerate a wide range of temperatures, light, and humidity conditions, Chinese elm is a popular choice as a bonsai species, and is perhaps the single most widely available. It is considered a good choice for beginners because of its high tolerance of pruning.

		
		
		


== Cultivars ==
Numerous cultivars have been raised, mostly in North America:


=== Hybrid cultivars ===
An autumn flowering species, whereas most other elms flower in spring. Hybrids have accordingly been very few:

Frontier
Rebella


== Accessions ==
North AmericaArnold Arboretum, US. Acc. nos. 1353-73, 17917, 195-90, 197-90.
Bartlett Tree Experts, US. Acc. nos. 5546, 8109.
Brenton Arboretum, Dallas Center, Iowa, US. No details available.
Brooklyn Botanic Garden, New York, US. Acc. nos. 000880, 160001, 20020466, 850222, X00450, X00485, X02727, X02771.
Chicago Botanic Garden, US. 2 trees, no other details available.
Dominion Arboretum, Ottawa, Ontario, Canada. No acc. details.
Fullerton Arboretum, California State University, US. Acc. no. 80-036.
Holden Arboretum, US. Acc. nos. 57-1241, 80-665, 84-1214, 90-323.
Longwood Gardens, US. Acc. nos. 1957-1058, 1959-1500, 1960-1138, 1991-0981.
Missouri Botanical Garden, St. Louis, US. Acc. nos. 1986-0108, 1986-0276, 1986-0277, 1987-0019, 199-3195, 1996-3462.
Morris Arboretum, University of Pennsylvania, US. Acc. no. 32-0052-A.
Morton Arboretum, US. Acc. nos. 991-27, 772-54, 1231–57, 558-83, 52-96.
New York Botanical Garden, US. Acc. nos. 195/56, 486/91, 68072.
Phipps Conservatory, US. Acc. nos. 83-006, 83-058, 91-050, 2001-212UN.
Scott Arboretum, US. Acc. nos. 62210, 71765, 71767, 71771, 75152, 64441.
Smith College, US. Acc. no. 42894.
U S National Arboretum, Washington, D.C., US. Acc. nos. 58000/1/2/3/4/5/6/7/8.EuropeBrighton & Hove City Council, UK. NCCPG Elm Collection.
Cambridge Botanic Garden, University of Cambridge, UK. No accession details available.
Dyffryn Gardens, Glamorgan. UK champion, 13 m high, 37 cm d.b.h., last surveyed 1997.
Grange Farm Arboretum, Sutton St. James, Spalding, Lincolnshire, UK. Acc. no. 516.
Hortus Botanicus Nationalis, Salaspils, Latvia. Acc. nos. 18150, 18151.
Linnaean Gardens of Uppsala, Sweden. Acc. no. 2002-1542.
Royal Botanic Gardens Kew. Acc. nos. 1979-1613, 1979-1614, 1982–8479, 1982-8505, 1982-6280, 1982-6284, 2002-137, 2003-1267, 2005-1076.
Royal Botanic Gardens Kew Wakehurst Place, UK. Acc. nos. 1969-33664, 1969-35133, 1973-21049, 1973-21525.
Royal Horticultural Society Gardens, Wisley, UK. No details available.
Wijdemeren City Council Elm arboretum: 4 cv. ‘UPMTF’ planted Molenmeent Loosdrecht in 2017.
Strona Arboretum, University of Life Sciences, Warsaw, Poland. No accession details available.
Tallinn Botanic Garden, Estonia. No accession details available.
Thenford House arboretum, Banbury, UK. No details available.
University of Copenhagen Botanic Garden. Denmark. Acc. nos. S1956-1338, S1997-1304.
Westonbirt Arboretum, Tetbury, Glos., UK. Planted 1981. No acc. no.AustralasiaEastwoodhill Arboretum, Gisborne, New Zealand. 9 trees, details not known.


== References ==


== External links ==
""Ulmus parvifolia Jacq. (1854) K000852632"". Herbarium catalogue. Board of Trustees of the Royal Botanic Gardens, Kew. Retrieved 17 October 2016.
""Ulmus parvifolia Jacq. (1867) K000852633"". Herbarium catalogue. Board of Trustees of the Royal Botanic Gardens, Kew. Retrieved 17 October 2016.
""Ulmus sieboldii Daveau (1913) K000852631"". Herbarium catalogue. Board of Trustees of the Royal Botanic Gardens, Kew. Retrieved 17 October 2016.
""Herbarium specimen - E00824803"". Herbarium Catalogue. Royal Botanic Garden Edinburgh. Ulmus parvifolia Jacq. (1909)
""Herbarium specimen - E00824804"". Herbarium Catalogue. Royal Botanic Garden Edinburgh. Ulmus parvifolia Jacq. (1902, Späth nursery)
""Herbarium specimen - E00824805"". Herbarium Catalogue. Royal Botanic Garden Edinburgh. Ulmus parvifolia Jacq. (1902, Späth)
""Herbarium specimen - E00824802"". Herbarium Catalogue. Royal Botanic Garden Edinburgh. Ulmus parvifolia Jacq. (1902, Späth)",
155,Viburnum_rufidulum,Shrub,https://en.wikipedia.org/wiki/Viburnum_rufidulum,"Viburnum rufidulum, also known as the rusty blackhaw, blue haw, rusty nanny-berry, or southern black haw, is a flowering species of shrub or small tree that is common in parts of the Eastern and Central United States. It produces attractive flowers and fall foliage, as well as fruits that are popular with some species of bird.


== Description ==

Leathery deciduous leaves are simple and grow in opposite blades ranging from 0.5-3 inches in length and 1-1.5 inches in width. Petioles are ""rusty hairy"" with grooves and sometimes wings. Leaf margins are serrate. Autumn leaf colors are bronze to red.Twigs range in color from ""reddish brown to gray""; young twigs are hairy, and get smoother with age.Bark is similar that of the flowering dogwood, ranging in color from ""reddish brown to almost black"" and forming ""blocky plates on larger trunks"".Viburnum rufidulum blooms in April to May with creamy white flowers that are bisexual, or perfect and similar to those of other Viburnum species, but with clusters as large as six inches wide.The fruits are purple or dark blue, glaucous, globose or ellipsoid drupes that mature in mid to late summer. The fruit has been said to taste like raisins and attract birds.


== Distribution ==
The rusty blackhaw prefers dry habitats with elevations generally below 750 m.It grows in Alabama, Arkansas, Florida, Georgia, Illinois, Indiana, Kansas, Kentucky, Louisiana, Mississippi, Missouri, North Carolina, Ohio, Oklahoma, South Carolina, Tennessee, Texas, Virginia, and West Virginia.


== Uses ==
It is occasionally used as an ornamental plant.


== Similar species ==
See Viburnum prunifolium (blackhaw). Petioles of V. prunifolium do not have the rusty hairs that those of V. rufidulum do.


== References ==


== External links ==
 Media related to Viburnum rufidulum at Wikimedia Commons",
156,Vitex_agnus-castus,Tree,https://en.wikipedia.org/wiki/Vitex_agnus-castus,"Vitex agnus-castus, also called vitex,  chaste tree (or chastetree), chasteberry, Abraham's balm, lilac chastetree, or monk's pepper, is a native of the Mediterranean region. It is one of the few temperate-zone species of Vitex, which is on the whole a genus of tropical and sub-tropical flowering plants. Theophrastus mentioned the shrub several times, as agnos (άγνος) in Enquiry into Plants. It has been long believed to be an anaphrodisiac – leading to its name as chaste tree – but its effectiveness for such action remains unproven.Vitex is a cross-pollinating plant, but its self-pollination has been recorded.


== Etymology and common names ==
Vitex, its name in Pliny the Elder, is derived from the Latin vieo, meaning to weave or to tie up, a reference to the use of Vitex agnus-castus in basketry. Its macaronic specific name repeats ""chaste"" in both Greek and Latin; the small tree was considered to be sacred to the virginal goddess Hestia/Vesta. The most common names are chaste tree, vitex, and monk's pepper.


== Description ==

Vitex agnus-castus is widely cultivated in warm temperate and subtropical regions for its delicate-textured aromatic foliage and butterfly-attracting mid-summer spikes of lavender flowers opening in late summer in cooler climates. It grows to a height of 1–5 m (3–16 ft). It requires full sun though tolerating partial shade, along with well-drained soil. Under ideal conditions it is hardy to −23 °C (−9 °F) USDA Zone 6, and can be found as far north as the south shore of Long Island and Nantucket on the East Coast of North America and in the mild southwest of England. In colder zones, the plant tends to die back to the ground, but as it flowers on new wood, flowering is not affected on vigorous growth in the following season. This plant is a brackish water dweller, indicating that it tolerates salt. Cold and wet weather results in dieback and losses. The plant grows well on loamy neutral to alkaline soil.In cultivation in the UK,  the form Vitex agnus-castus f. latifolia has gained the Royal Horticultural Society’s Award of Garden Merit.The monk's pepper fruits from one single tree can be harvested for more than 15 years. This indicates that the monk's pepper cannot be integrated in a usual crop rotation system. It is suggested to sow dissimilar plants such as monocots as its subsequent crop so that it might be easier to control the monk's pepper plant, the dicot. Because the fruits of monk's pepper tend to fall constantly and uncontrollably, it is likely that the plant can germinate from seed. It is said that at a row spacing of 180 cm (71 in), the overall best yield per hectare can be achieved if the plant spacing is around 70 cm (28 in). Pruning back the branches in autumn has a positive influence on fruit yield while a re-pruning in spring can induce an increase of vegetative shoot and thus to fruit yield loss.


=== Reproduction ===
This plant can also be reproduced vegetatively. One possibility is to use 5–8 cm (2–3 in) long piece of the ripening wood with buds in July or August and another is to cut the ripe wood in November and then let it root in a coldframe. Also in vitro reproduction with spike of the shoots or node explants is possible.


=== Harvest ===
The flowering and ripening processes do not happen simultaneously, enabling harvesting of both fresh fruits and seeds over a long span of time. The fruits tend to fall from the plant as they ripen, getting lost in the soil. Thus, there is no optimal fixed harvest time. Consequently, to avoid yield loss, unripe fruits need to be harvested. This early harvesting has no effect on quality. Overall it is said that harvesting the fruits by hand is the most convenient solution.


=== Diseases and pests ===
Thysanoptera, also known as thrips, can cause great damage to the growth and the generative development of Vitex agnus-castus. The insect feeds on chaste tree by sucking up the contents or puncturing them. As well chaste tree is the only known host (especially in Israel) for Hyalesthus obsoletus. This cicada is the vector for black wood disease of grapevines. Hyalesthus obsoletus prefers V. agnus-castus  as a host to the grapevine. In this case chaste tree can be used as a biological control agent by planting it around vineyards to trap the Hyalesthus obsoletus.V. agnus-castus was found not only to be an appropriate food source for the adult vectors, but also a reservoir of Candidatus Phytoplasma solani (bacterial Phytoplasma species), the causal agent of the Black wood disease in grapevines. 
The pathogen-caused leaf spot disease can almost defoliate V. agnus castus. Furthermore, root rot can occur when soils are kept too moist.


== Chemical compounds ==
Flavonoids (vitexin, casticin), iridoid glycoside (agnuside, aucubin), p-hydroxybenzoic acid, alkaloids, essential oils, fatty oils, diterpenoids and steroids have been identified in the chemical analysis of Vitex agnus-castus. They occur in the fruits and in the leaves.


=== Essential oils ===
Essential oils have been found in the fruits and in the leaves. The oil of leaves, unripe and ripe fruits differ in compounds. 50 compounds were identified in the oil of unripe fruits, 51 compounds in the oil of ripe fruits and 46 compounds in the oil of the leaves. 1,8-cineole and sabinene are the main monoterpene components and beta-caryophyllene is the major sesquiterpene compound found in the fruits of Vitex agnus-castus. There are some slight differences between fruits from white flowering plants and such from violet flowering ones. The oil of fruits of white flowering plants have a higher amount of monoterpene constituents. The leaves mainly contain 1,8-cineole, trans-beta-farnesene, alpha-pinene, trans-beta-caryophyllene, and terpinen-4-ol. The oil, particularly from white flowering plants, is under preliminary research for its potential antibacterial effects.


== Herbal uses ==
The leaves and tender stem growth of the upper 10 cm (3.9 in), along with the flowers and ripening seeds, are harvested for alternative medicinal purposes. It is believed the berries are a tonic herb for both the male and female reproductive systems. The leaves are believed to have the same effect, but to a lesser degree. The leaves, flowers, and/or berries may be consumed as a decoction, traditional tincture, cider vinegar tincture, syrup, elixir, or simply eaten from the plant with presumed benefits as food. A popular way of taking Vitex is on awakening as a simple 1:1 fluid extract, which is said to interact with hormonal circadian rhythms most effectively.In ancient times, it was believed to be an anaphrodisiac, hence the name chaste tree. Pliny, in his Historia Naturalis, reported the use of stems and leaves of this plant by women as bedding ""to cool the heat of lust"" during the time of the Thesmophoria, when Athenian women left their husbands to remain ritually chaste. At the end of the 13th century, John Trevisa reported of it ""the herbe agnus-castus is always grene, and the flowre therof is namly callyd Agnus Castus, for wyth smel and vse it maketh men chaste as a lombe"".  Chaucer, in ""The Flower and the Leaf,"" referred to it as an attribute of the chaste Diana, and in the 16th century the English herbalist William Turner reported the same anaphrodisiac properties of the seed, both fried and not fried.


== Traditional medicine ==
Despite numerous studies, there is limited clinical evidence for the effectiveness of vitex plant extracts to manage premenstrual stress syndrome, including premenstrual dysphoric disorder and latent hyperprolactinaemia. Although the medication is recommended in Germany, there are further indications that Vitex agnus-castus should be avoided during pregnancy due to the possibility of complications.


== Safety and adverse effects ==
The most frequent adverse effects from vitex use include nausea, headache, gastrointestinal discomfort, menstrual discomfort, fatigue, and skin disorders. People taking dopamine-related medications or Parkinson’s disease medications should avoid using chasteberry. Women on birth control pills, hormone replacement therapy, or having a hormone-sensitive condition, such as breast cancer, are advised not to use chasteberry. Use of vitex is discouraged for pregnant or breastfeeding women, and for children.


== References ==


== External links ==
Medicine Docs: Vitex agnus-castus (medicinal plant)",
157,Washingtonia_robusta,House Plant,https://en.wikipedia.org/wiki/Washingtonia_robusta,"Washingtonia robusta, the Mexican fan palm or Mexican washingtonia, is a palm tree native to western Sonora, and Baja California Sur in northwestern Mexico. It is reportedly naturalized in Florida, California, Hawaii, Texas, parts of the Canary Islands, Italy, Lebanon,  Spain, and Réunion,


== Description ==
Washingtonia robusta grows to 25 m (82 ft) tall, rarely up to 30 m (98 ft). The leaves have a petiole up to 1 m (3.3 ft) long, and a palmate fan of leaflets up to 1 m long. The inflorescence is up to 3 m (9.8 ft) long, with numerous small pale orange-pink flowers. The fruit is a spherical, blue-black drupe, 6–8 mm (0.24–0.31 in) diameter; it is edible, though thin-fleshed.


== Cultivation ==

Like the closely related Washingtonia filifera (California Fan Palm), it is grown as an ornamental tree. Although very similar, the Mexican Washingtonia has a narrower trunk (which is typically somewhat wider at the base), and grows slightly faster and taller; it is also somewhat less cold hardy than the California Washingtonia, hardy to about −8 °C (18 °F).
Field research conducted on Washingtonia robusta in its native habitat on the Baja California peninsula concluded that its potential longevity may exceed 500 years.Supporting research by Barry Tomlinson and Brett Huggett states that there is ""evidence for extreme longevity of metabolically functioning cells of considerable diversity in palm stems.""  Many of the iconic ""sky dusters"" of Los Angeles that have survived the chainsaws of progress are documented in photography from the 19th century.
Unlike Washingtonia filifera, which has been cultivated as far north as Utah, the Mexican fan palm is normally grown in the desert southwestern United States, in areas such as California, Arizona, Southern Nevada, New Mexico and Texas. It also cultivated in the coastal areas of south Atlantic states and Gulf Coast, including extreme southern North Carolina, coastal South Carolina, southern Georgia, and Florida. Along the Gulf Coast, Mexican fan palms can be found growing along the Florida west coast westward to southern Texas.
Washingtonia × filibusta is a hybrid of W. robusta and W. filifera and has intermediate characteristics of the two parents, especially greater tolerance of wet cold.


== Gallery ==

		
		
		
		
		
		
		
		
		


== References ==


== External links ==
Flora of North America Vol. 22 Page 106 Mexican fan palm, palmier évantail du Mexique  Washingtonia robusta H. Wendland, Garten-Zeitum (Berlin). 2: 198. 1883.
Scanpalm - Washingtonia robusta",
158,Wedelia_acapulcensis,Perennial,https://en.wikipedia.org/wiki/Wedelia_acapulcensis,"Wedelia acapulcensis, commonly known as Acapulco wedelia, is a species of flowering plant in the sunflower family, Asteraceae.  It is native to Texas in the United States, Mexico, and Central America.


== Varieties ==
Wedelia acapulcensis var. acapulcensis
Wedelia acapulcensis var. hispida (Kunth) Strother (=Lipochaeta texana Torr. & A.Gray, W. hispida Kunth, W. texana (A.Gray) B.L.Turner, Zexmenia hispida (Kunth) A.Gray ex Small) – Hairy Wedelia, Orange Wedelia, Orange Zexmenia


== References ==


== External links ==
 Media related to Wedelia acapulcensis at Wikimedia Commons
 Data related to Wedelia acapulcensis at Wikispecies",
